{
  "links": "https://www.ycombinator.com/companies/frubana-inc",
  "name": "Frubana Inc",
  "headline": "The everything store for restaurants in LATAM.",
  "batch": "W19",
  "description": null,
  "activity_status": "Active",
  "website": "https://www.frubana.com",
  "founded_date": 2018.0,
  "team_size": 384.0,
  "location": "São Paulo, Brazil",
  "group_partner": null,
  "group_partner_yc": null,
  "company_linkedin": null,
  "company_twitter": null,
  "tags": "industry:fintech; industry:b2b; industry:logistics",
  "founders": [],
  "status": true,
  "markdown": "raw_markdown='![](https://www.frubana.com/img/header/logo.svg) ![](https://www.frubana.com/img/frubana-logo-icon.svg)\\n![delivery](https://www.frubana.com/img/delivery_men.svg)\\nEscolha sua cidade\\n[ Campinas ![](https://www.frubana.com/img/arrow_right.svg) ](https://www.frubana.com/<vcp>)[ São Paulo ![](https://www.frubana.com/img/arrow_right.svg) ](https://www.frubana.com/<spo>)[ Belo Horizonte ![](https://www.frubana.com/img/arrow_right.svg) ](https://www.frubana.com/<bhz>)[ Curitiba ![](https://www.frubana.com/img/arrow_right.svg) ](https://www.frubana.com/<cwb>)\\nJunte-se a nós: [Trabalhar com a gente](https://www.frubana.com/<https:/jobs.lever.co/frubana>) [Quiero ser proveedor](https://www.frubana.com/<https:/docs.google.com/forms/d/e/1FAIpQLSel7pASuuaEmilk3M5MlPMwzp1mE4RuEzKesVtKF8IkjgbgKg/viewform?usp=sf_link>)\\n' markdown_with_citations='![](https://www.frubana.com/img/header/logo.svg) ![](https://www.frubana.com/img/frubana-logo-icon.svg)\\n![delivery⟨1⟩]\\nEscolha sua cidade\\n Campinas ![⟨2⟩ ](https://www.frubana.com/<vcp>) São Paulo ![⟨2⟩ ](https://www.frubana.com/<spo>) Belo Horizonte ![⟨2⟩ ](https://www.frubana.com/<bhz>) Curitiba ![⟨2⟩ ](https://www.frubana.com/<cwb>)\\nJunte-se a nós: Trabalhar com a gente⟨3⟩ Quiero ser proveedor⟨4⟩\\n' references_markdown='\\n\\n## References\\n\\n⟨1⟩ https://www.frubana.com/img/delivery_men.svg: delivery\\n⟨2⟩ https://www.frubana.com/img/arrow_right.svg:  Campinas ![\\n⟨3⟩ https://www.frubana.com/<https:/jobs.lever.co/frubana>: Trabalhar com a gente\\n⟨4⟩ https://www.frubana.com/<https:/docs.google.com/forms/d/e/1FAIpQLSel7pASuuaEmilk3M5MlPMwzp1mE4RuEzKesVtKF8IkjgbgKg/viewform?usp=sf_link>: Quiero ser proveedor\\n' fit_markdown='' fit_html=''",
  "generated_description": "### Frubana Inc: Your One-Stop Shop for Latin American Restaurants\n\nFounded in 2018 and hailing from the vibrant city of São Paulo, Brazil, Frubana Inc is on a mission to be \"the everything store for restaurants in LATAM.\" The company has made a name for itself as a game-changer for the restaurant industry in Latin America, and it's part of Y Combinator's Batch W19, which adds a layer of credibility to its startup credentials.\n\nWith a dedicated team of 384 employees, Frubana operates in the intersection of fintech, B2B services, and logistics. This unique blend of sectors allows them to create streamlined solutions that cater to the myriad needs of restaurants—making it easier for them to source ingredients, supplies, and other essential items all from one platform.\n\nWhat really sets Frubana apart is its user-friendly website, [frubana.com](https://www.frubana.com), that engages users with an easy selection process for different cities—whether you’re in Campinas, São Paulo, Belo Horizonte, or Curitiba. Their approach focuses on offering convenience and efficiency, ensuring that restaurants can focus on what they do best: serving great food.\n\nFrubana is not just looking to build a marketplace; they’re creating a community. They actively invite potential suppliers and job seekers to join their growing platform, recognizing that their ecosystem is only as strong as the partnerships they forge.\n\nIn summary, Frubana Inc is more than just a logistics company; it's a pivotal resource for restaurants across Latin America, combining technology and industry expertise to forge a path for an innovative future in dining. If you're in the restaurant business in LATAM, Frubana is definitely worth keeping on your radar."
}